{
  "contractVersion": "1.0.0",
  "capability": {
    "id": "master.timetable",
    "version": "1.0.0"
  },
  "ownerDomain": "academic",
  "permission": "academic.timetable.read",
  "sensitivity": "SENSITIVE",
  "contractReference": "/api/v1/master/academic/timetable/availability",
  "relatedEvents": [],
  "operations": [
    {
      "operationId": "readMasterStaffTimetableSlots",
      "method": "GET",
      "path": "/api/v1/master/academic/timetable/staff/{staffId}/slots",
      "permission": "academic.timetable.read",
      "parameters": [
        {
          "schema": {
            "pattern": "^\\d{4}-\\d{2}-\\d{2}$",
            "type": "string"
          },
          "in": "query",
          "name": "fromDate",
          "required": true
        },
        {
          "schema": {
            "pattern": "^\\d{4}-\\d{2}-\\d{2}$",
            "type": "string"
          },
          "in": "query",
          "name": "toDate",
          "required": true
        },
        {
          "schema": {
            "format": "uuid",
            "type": "string"
          },
          "in": "path",
          "name": "staffId",
          "required": true
        }
      ],
      "responses": {
        "200": {
          "description": "Default Response",
          "content": {
            "application/json": {
              "schema": {
                "additionalProperties": false,
                "type": "object",
                "required": [
                  "data"
                ],
                "properties": {
                  "data": {
                    "type": "object",
                    "required": [
                      "state",
                      "publications",
                      "dates",
                      "items"
                    ],
                    "properties": {
                      "state": {
                        "anyOf": [
                          {
                            "type": "string",
                            "enum": [
                              "PROVEN"
                            ]
                          },
                          {
                            "type": "string",
                            "enum": [
                              "NO_SCHEDULE"
                            ]
                          },
                          {
                            "type": "string",
                            "enum": [
                              "UNPROVEN"
                            ]
                          },
                          {
                            "type": "string",
                            "enum": [
                              "CONFLICT"
                            ]
                          }
                        ]
                      },
                      "publications": {
                        "type": "array",
                        "items": {
                          "type": "object",
                          "required": [
                            "id",
                            "academicYearId",
                            "sourceVersionLabel",
                            "effectiveFrom"
                          ],
                          "properties": {
                            "id": {
                              "format": "uuid",
                              "type": "string"
                            },
                            "academicYearId": {
                              "format": "uuid",
                              "type": "string"
                            },
                            "sourceVersionLabel": {
                              "minLength": 1,
                              "maxLength": 40,
                              "type": "string"
                            },
                            "effectiveFrom": {
                              "minLength": 1,
                              "maxLength": 10,
                              "type": "string"
                            }
                          }
                        }
                      },
                      "dates": {
                        "type": "array",
                        "items": {
                          "type": "object",
                          "required": [
                            "date",
                            "state",
                            "publication"
                          ],
                          "properties": {
                            "date": {
                              "minLength": 1,
                              "maxLength": 10,
                              "type": "string"
                            },
                            "state": {
                              "anyOf": [
                                {
                                  "type": "string",
                                  "enum": [
                                    "PROVEN"
                                  ]
                                },
                                {
                                  "type": "string",
                                  "enum": [
                                    "NO_SCHEDULE"
                                  ]
                                },
                                {
                                  "type": "string",
                                  "enum": [
                                    "UNPROVEN"
                                  ]
                                },
                                {
                                  "type": "string",
                                  "enum": [
                                    "CONFLICT"
                                  ]
                                }
                              ]
                            },
                            "publication": {
                              "type": "object",
                              "required": [
                                "id",
                                "academicYearId",
                                "sourceVersionLabel",
                                "effectiveFrom"
                              ],
                              "properties": {
                                "id": {
                                  "format": "uuid",
                                  "type": "string"
                                },
                                "academicYearId": {
                                  "format": "uuid",
                                  "type": "string"
                                },
                                "sourceVersionLabel": {
                                  "minLength": 1,
                                  "maxLength": 40,
                                  "type": "string"
                                },
                                "effectiveFrom": {
                                  "minLength": 1,
                                  "maxLength": 10,
                                  "type": "string"
                                }
                              },
                              "nullable": true
                            }
                          }
                        }
                      },
                      "items": {
                        "type": "array",
                        "items": {
                          "type": "object",
                          "required": [
                            "slotId",
                            "publicationId",
                            "date",
                            "weekday",
                            "periodIndex",
                            "staffId",
                            "classId",
                            "classLabel",
                            "subjectId",
                            "subjectCode",
                            "subjectLabel"
                          ],
                          "properties": {
                            "slotId": {
                              "format": "uuid",
                              "type": "string"
                            },
                            "publicationId": {
                              "format": "uuid",
                              "type": "string"
                            },
                            "date": {
                              "minLength": 1,
                              "maxLength": 10,
                              "type": "string"
                            },
                            "weekday": {
                              "minimum": 1,
                              "maximum": 7,
                              "type": "integer"
                            },
                            "periodIndex": {
                              "minimum": 0,
                              "maximum": 14,
                              "type": "integer"
                            },
                            "staffId": {
                              "format": "uuid",
                              "type": "string"
                            },
                            "classId": {
                              "format": "uuid",
                              "type": "string"
                            },
                            "classLabel": {
                              "minLength": 1,
                              "maxLength": 120,
                              "type": "string"
                            },
                            "subjectId": {
                              "format": "uuid",
                              "type": "string"
                            },
                            "subjectCode": {
                              "minLength": 1,
                              "maxLength": 40,
                              "type": "string"
                            },
                            "subjectLabel": {
                              "minLength": 1,